<?xml version="1.0" encoding="UTF-8"?>
<!DOCTYPE ProjetAlgorithmesDeClustering SYSTEM 'ca.dtd'>
<?xml-stylesheet type="text/xsl" href="ca.xslt"?>
<ProjetAlgorithmesDeClustering>
    <IntroductionCA nom="Introduction">
        <intro>Les algorithmes de clustering sont des techniques d'apprentissage automatique qui regroupent des données en sous-ensembles appelés clusters, afin de rendre chaque cluster homogène par rapport à certaines caractéristiques. Le clustering est utile dans des domaines variés, de la segmentation de clientèle à la biologie computationnelle, en passant par l’analyse de réseaux sociaux et la reconnaissance d'images. L’objectif principal est d'identifier des structures cachées et des similitudes entre données, facilitant leur compréhension et la prise de décisions informées.</intro>
    </IntroductionCA>

    <Sommaire>
        <section titre="Introduction"/>
        <section titre="Types d'Algorithmes de Clustering"/>
        <section titre="Applications"/>
        <section titre="Détails de l'Algorithme K-means"/>
        <section titre="Métriques d'Évaluation"/>
        <section titre="Défis et Limitations"/>
        <section titre="Avancées et Tendances"/>
        <section titre="Conclusion"/>
    </Sommaire>

    <PresentationCA nom="Présentation">
        <definition>Le clustering est un processus non supervisé qui permet de grouper des données sans étiquettes en clusters homogènes. Contrairement aux méthodes supervisées qui requièrent des étiquettes, le clustering permet l’exploration autonome des données pour découvrir des patterns cachés. Il est couramment utilisé dans le marketing, la médecine, et la vision par ordinateur pour la segmentation de données et la reconnaissance de schémas complexes.</definition>
        <utilisationsCA>
            <utilisation nom="Segmentation de Marché">Le clustering est utilisé pour segmenter des clients en groupes distincts selon des critères tels que leurs comportements d'achat ou leurs préférences. Par exemple, dans le commerce de détail, un modèle de clustering pourrait regrouper les clients en fonction de leurs habitudes d'achat, permettant aux entreprises de mieux cibler leurs campagnes marketing.</utilisation>
            <utilisation nom="Analyse des Réseaux Sociaux">Le clustering aide à identifier des communautés et groupes d’intérêts dans les réseaux sociaux. Par exemple, en regroupant des utilisateurs selon leurs interactions, les analystes peuvent comprendre les tendances, cibler des annonces plus efficacement, et analyser les dynamiques d'influence.</utilisation>
            <utilisation nom="Classification des Images">Dans la vision par ordinateur, le clustering permet de regrouper des images similaires, facilitant des tâches comme la reconnaissance d'objets ou la recherche d'images similaires. Des algorithmes comme K-means peuvent organiser des photos en groupes selon les personnes ou les scènes présentes.</utilisation>
            <utilisation nom="Biologie Computationnelle">En biologie, le clustering est utilisé pour classer des séquences génétiques, analyser des populations de cellules, et identifier des biomarqueurs potentiels. Par exemple, les algorithmes de clustering peuvent regrouper des cellules similaires pour étudier la diversité des types cellulaires et les caractéristiques génétiques.</utilisation>
        </utilisationsCA>
    </PresentationCA>

    <TypesCA nom="Types d'Algorithmes de Clustering">
        <type nom="K-means">
            <definition_type>K-means est un algorithme de partitionnement qui divise les données en K clusters, où chaque point est assigné au cluster le plus proche. L’algorithme itère entre l’assignation des points aux clusters et le recalcul des centres de clusters (centroïdes), jusqu'à ce que les clusters soient stables.</definition_type>
            <avantages>Il est simple et rapide pour les grands ensembles de données. Sa complexité est linéaire, ce qui en fait un choix populaire pour des tâches rapides de partitionnement de données.</avantages>
            <limitations>Il nécessite de définir le nombre de clusters à l’avance, et il est sensible aux valeurs aberrantes. K-means tend à créer des clusters de forme sphérique, ce qui peut être limitatif pour certains ensembles de données.</limitations>
        </type>
        <type nom="Clustering Hiérarchique">
            <definition_type>Le clustering hiérarchique construit une hiérarchie de clusters sous forme d'arbre (dendrogramme). Il peut être agglomératif, en fusionnant progressivement les clusters, ou divisif, en divisant un cluster en sous-clusters.</definition_type>
            <avantages>Il ne nécessite pas de nombre de clusters défini à l’avance et permet une représentation hiérarchique des données.</avantages>
            <limitations>Il est coûteux en termes de calcul pour de grands ensembles de données, car il nécessite de stocker toutes les distances entre points.</limitations>
        </type>
        <type nom="DBSCAN">
            <definition_type>DBSCAN (Density-Based Spatial Clustering of Applications with Noise) identifie les clusters selon la densité des points de données. Il est capable de détecter des clusters de formes variées et de distinguer le bruit.</definition_type>
            <avantages>Il ne nécessite pas de nombre de clusters prédéfini et gère bien les valeurs aberrantes.</avantages>
            <limitations>Les paramètres de densité (epsilon et minPts) peuvent être difficiles à ajuster, et il peut ne pas fonctionner aussi bien pour des clusters de densités variées.</limitations>
        </type>
        <type nom="Mean Shift">
            <definition_type>Mean Shift est un algorithme de clustering qui utilise des fenêtres de densité pour déplacer les points vers les régions à haute densité, identifiant ainsi automatiquement les clusters.</definition_type>
            <avantages>Il détecte automatiquement le nombre de clusters et est adapté à des clusters de formes diverses.</avantages>
            <limitations>Il est coûteux pour de grands ensembles de données, et la taille de fenêtre doit être soigneusement choisie.</limitations>
        </type>
    </TypesCA>

    <ApplicationCA nom="Applications">
        <application nom="Santé">
            <description_application>Dans la santé, les algorithmes de clustering permettent de classer les patients selon des caractéristiques similaires (symptômes, traitements, etc.). Par exemple, un hôpital pourrait regrouper les patients en fonction de profils de maladies similaires pour optimiser le traitement et la gestion des soins.</description_application>
        </application>
        <application nom="Finance">
            <description_application>En finance, le clustering est utilisé pour détecter des schémas de comportement des clients et identifier des comportements frauduleux. Par exemple, les banques utilisent le clustering pour créer des profils de clients, faciliter la gestion des portefeuilles et détecter les anomalies dans les transactions.</description_application>
        </application>
        <application nom="Commerce Électronique">
            <description_application>Les sites de commerce électronique utilisent le clustering pour recommander des produits similaires, segmenter les utilisateurs et optimiser l'expérience d'achat. Par exemple, en regroupant les utilisateurs en fonction de leurs préférences, le site peut proposer des recommandations personnalisées.</description_application>
        </application>
    </ApplicationCA>

    <AlgorithmeDetailleCA nom="Détails de l'Algorithme K-means">
        <algorithmeNom>K-means</algorithmeNom>
        <algorithmeDescription>K-means est un algorithme itératif qui divise un ensemble d'observations en K clusters prédéfinis en minimisant la variance intra-cluster. Chaque observation appartient au cluster dont le centroïde est le plus proche.</algorithmeDescription>
        <etapes>
            <etape numero="1">Initialiser K centroïdes soit aléatoirement, soit avec une méthode comme K-means++.</etape>
            <etape numero="2">Attribuer chaque point de données au centroïde le plus proche en calculant la distance entre les points et les centres de clusters.</etape>
            <etape numero="3">Recalculer les centres des clusters en prenant la moyenne des points de chaque cluster.</etape>
            <etape numero="4">Répéter les étapes d'assignation et de recalcul jusqu'à ce que les centres des clusters ne changent plus.</etape>
        </etapes>
        <avantages>Simple à implémenter et rapide pour des ensembles de données de taille modérée.</avantages>
        <limitations>Nécessite de connaître le nombre de clusters à l'avance et sensible aux valeurs aberrantes.</limitations>
    </AlgorithmeDetailleCA>

    <MetricsCA nom="Métriques d'Évaluation">
        <metric nom="Score de Silhouette">
            <description_metric>Le score de silhouette mesure la cohésion et la séparation des clusters. Il varie de -1 à 1, où un score proche de 1 indique que les points sont bien regroupés et distincts d'autres clusters, tandis qu'un score proche de -1 indique une mauvaise assignation.</description_metric>
        </metric>
        <metric nom="Indice de Davies-Bouldin">
            <description_metric>L'indice de Davies-Bouldin évalue la qualité des clusters en mesurant la similarité moyenne entre chaque cluster et celui qui lui est le plus similaire. Un indice faible signifie que les clusters sont bien séparés.</description_metric>
        </metric>
    </MetricsCA>

    <DefisLimitationsCA nom="Défis et Limitations">
        <defi nom="Scalabilité">
            <description_defi>Les algorithmes de clustering peuvent devenir coûteux en temps de calcul et en mémoire pour des ensembles de données très larges. Des techniques comme le clustering distribué ou les approximations sont souvent nécessaires pour rendre ces algorithmes viables dans des contextes de big data.</description_defi>
        </defi>